[
  {
    "slug": "7q10",
    "title": "7Q10",
    "kind": "term",
    "aliases": [
      "7Q10 low flow",
      "seven-day ten-year low flow"
    ],
    "tags": [
      "hydrology",
      "permitting",
      "water-quality"
    ],
    "summary": "The lowest 7-consecutive-day average streamflow expected on average once every ten years — the design low flow for sizing effluent dilution.",
    "related": [
      "assimilative-capacity",
      "consumptive-cooling"
    ],
    "body": "The **7Q10** is a low-flow statistic: the lowest average streamflow over any\nseven consecutive days that, statistically, recurs about once every ten years. It\nis the conventional *design low flow* in NPDES permitting — the worst-case\ndilution condition a discharge must meet water-quality criteria under.\n\nBecause it represents the stream at its weakest, the 7Q10 is the denominator in an\n[[assimilative capacity]] screen: the lower the design flow, the less clean water\nis available to dilute a pollutant load or to absorb a reduction in flow from\n[[consumptive cooling]]. In the BOSC analysis the Ottawa River at Lima 7Q10 is\nread from the Ohio EPA NPDES fact sheet stream-flows table, not estimated."
  },
  {
    "slug": "assimilative-capacity",
    "title": "Assimilative capacity",
    "kind": "concept",
    "aliases": [
      "assimilative headroom",
      "dilution capacity"
    ],
    "tags": [
      "hydrology",
      "water-quality"
    ],
    "summary": "A stream's ability to dilute or assimilate an added load (or a loss of flow) without breaching water-quality criteria, evaluated at design low flow.",
    "related": [
      "7q10",
      "consumptive-cooling"
    ],
    "body": "**Assimilative capacity** is the headroom a receiving water has to absorb a\npollutant load — or a withdrawal of flow — before a water-quality criterion would\nbe exceeded. It is evaluated at a design low flow, conventionally the\n[[7Q10]], so the screen reflects the stream when it is least able to dilute.\n\nIn the water-balance analysis, the campus's [[consumptive cooling]] draw is\nsubtracted from the live Ottawa River flow and compared against the 7Q10: a\nnegative balance means the consumptive loss erodes the dilution flow the permit\nrecord assumes, shrinking assimilative headroom. A negative figure is a screening\nflag — a lead to verify against the live gauge and the permit, not a verdict."
  },
  {
    "slug": "common-control-plumbing",
    "title": "Common-control plumbing",
    "kind": "concept",
    "aliases": [
      "common control",
      "registered-agent overlap"
    ],
    "tags": [
      "entities",
      "methodology",
      "evidence-discipline"
    ],
    "summary": "Shared registered agents, organizers, or addresses across entities — evidence of common administrative control, not of beneficial ownership.",
    "related": [
      "hyperscale-data-center",
      "public-records-mandamus"
    ],
    "body": "**Common-control plumbing** is the term this project uses for the administrative\noverlaps that recur across the entity record: a shared registered agent, the same\norganizer or counsel, a reused mailing address. Those overlaps are evidence that\nentities are *administered together* — the plumbing of common control — and are\nuseful for resolving who is really one actor in the entity graph.\n\nThey are deliberately **not** statements about beneficial ownership. Per the\nsite's evidence discipline, such links are tagged `[inference]` (a labelled\nreading of the record), and the graph's roles and edges are leads to verify, not\nverdicts. The distinction matters most where the plumbing connects the entities\nassembling a [[hyperscale data center]] campus."
  },
  {
    "slug": "consumptive-cooling",
    "title": "Consumptive cooling",
    "kind": "concept",
    "aliases": [
      "consumptive water use",
      "evaporative cooling loss"
    ],
    "tags": [
      "hydrology",
      "data-center",
      "water-balance"
    ],
    "summary": "Cooling water that is withdrawn and lost (mostly to evaporation) rather than returned to the source, reducing downstream flow.",
    "related": [
      "assimilative-capacity",
      "7q10",
      "hyperscale-data-center"
    ],
    "body": "**Consumptive cooling** is the share of a facility's cooling-water withdrawal that\ndoes not return to the watercourse — primarily evaporative loss from cooling\ntowers. Unlike a once-through return, a consumptive draw permanently removes flow\nfrom the system downstream of the intake.\n\nFor a [[hyperscale data center]], the consumptive fraction of the cooling demand\nis the quantity that matters to the river: it is subtracted from live flow in the\n[[assimilative capacity]] screen against the [[7Q10]]. The water-balance model\ntreats the cooling demand and its consumptive fraction as scenario inputs\n(labelled assumptions), while the receiving-water flows are read from live gauges\nand the permit record."
  },
  {
    "slug": "hyperscale-data-center",
    "title": "Hyperscale data center",
    "kind": "term",
    "aliases": [
      "hyperscale",
      "data center campus"
    ],
    "tags": [
      "data-center",
      "zoning",
      "land-use"
    ],
    "summary": "A very large, cloud-scale data center campus; the local zoning code defines the term and gates it as a conditional use.",
    "related": [
      "consumptive-cooling",
      "common-control-plumbing"
    ],
    "body": "A **hyperscale data center** is a data center built and operated at cloud scale —\ntypically multiple large halls on a single campus, with substantial electrical\nand cooling infrastructure. The term is not just colloquial here: the American\nTownship zoning resolution defines *Data Center / Hyperscale Data Center* and\ntreats it as a conditional use in its industrial district.\n\nThe land-use footprint is what ties the term to the rest of this record — the\nparcels assembled for the campus, the conditional-use application, and the\n[[consumptive cooling]] draw the cooling infrastructure implies. Who controls the\nassembling entities is a separate question, read through\n[[common-control plumbing]] rather than asserted."
  },
  {
    "slug": "public-records-mandamus",
    "title": "Public-records mandamus",
    "kind": "term",
    "aliases": [
      "mandamus",
      "PRR mandamus",
      "public records request"
    ],
    "tags": [
      "legal",
      "public-records",
      "transparency"
    ],
    "summary": "In Ohio, a writ of mandamus is the remedy that compels a public office to produce records improperly withheld under the Public Records Act.",
    "related": [
      "common-control-plumbing"
    ],
    "body": "A **public-records request (PRR)** asks a public office to produce records under\nOhio's Public Records Act (R.C. 149.43). When an office withholds or fails to\nproduce responsive records, the statutory remedy is a writ of **mandamus** — a\ncourt order compelling production (and, in some cases, statutory damages).\n\nIn this record, the mandamus thread is the lever that pried loose otherwise\nwithheld material: the withholding map, the source instruments, and the\nproduction analyses sit under the legal-history section. The records it produced\nare what the structured extractions and the entity graph are built on — which is\nwhy the [[common-control plumbing]] read from them is only as complete as the\nproduction was."
  }
]
